{
  "$schema": "https://developers.openai.com/apps-sdk/schemas/chatgpt-app-submission.v1.json",
  "schema_version": 1,
  "app_info": {
    "display_name": "Kinic Wiki",
    "subtitle": "Search and update your wiki",
    "description": "Kinic Wiki connects ChatGPT to wiki databases available to the signed-in user. It can discover and search databases, read task-focused context and evidence, create or replace nodes, and apply atomic append, edit, move, or delete operations with etag conflict protection.",
    "category": "PRODUCTIVITY"
  },
  "tools": {
    "find_databases": {
      "annotations": {
        "readOnlyHint": true,
        "openWorldHint": false,
        "destructiveHint": false
      },
      "justifications": {
        "read_only_justification": "Only lists and ranks database metadata visible to the signed-in user without modifying any database.",
        "open_world_justification": "Does not publish, submit, or change public internet state or third-party systems.",
        "destructive_justification": "Does not delete, overwrite, revoke access, or perform irreversible actions."
      }
    },
    "search": {
      "annotations": {
        "readOnlyHint": true,
        "openWorldHint": false,
        "destructiveHint": false
      },
      "justifications": {
        "read_only_justification": "Only searches node indexes in one database visible to the signed-in user and returns matching metadata.",
        "open_world_justification": "Does not publish, submit, or change public internet state or third-party systems.",
        "destructive_justification": "Does not delete, overwrite, revoke access, or perform irreversible actions."
      }
    },
    "fetch_many": {
      "annotations": {
        "readOnlyHint": true,
        "openWorldHint": false,
        "destructiveHint": false
      },
      "justifications": {
        "read_only_justification": "Only reads up to ten nodes selected from search results and returns item-level errors without changing them.",
        "open_world_justification": "Does not publish, submit, or change public internet state or third-party systems.",
        "destructive_justification": "Does not delete, overwrite, revoke access, or perform irreversible actions."
      }
    },
    "read_path": {
      "annotations": {
        "readOnlyHint": true,
        "openWorldHint": false,
        "destructiveHint": false
      },
      "justifications": {
        "read_only_justification": "Only reads one node at a known path in a database visible to the signed-in user.",
        "open_world_justification": "Does not publish, submit, or change public internet state or third-party systems.",
        "destructive_justification": "Does not delete, overwrite, revoke access, or perform irreversible actions."
      }
    },
    "read_paths": {
      "annotations": {
        "readOnlyHint": true,
        "openWorldHint": false,
        "destructiveHint": false
      },
      "justifications": {
        "read_only_justification": "Only reads two to ten known paths in one database and returns item-level errors without changing them.",
        "open_world_justification": "Does not publish, submit, or change public internet state or third-party systems.",
        "destructive_justification": "Does not delete, overwrite, revoke access, or perform irreversible actions."
      }
    },
    "list": {
      "annotations": {
        "readOnlyHint": true,
        "openWorldHint": false,
        "destructiveHint": false
      },
      "justifications": {
        "read_only_justification": "Only lists node inventory under a prefix without returning or changing node content.",
        "open_world_justification": "Does not publish, submit, or change public internet state or third-party systems.",
        "destructive_justification": "Does not delete, overwrite, revoke access, or perform irreversible actions."
      }
    },
    "memory_manifest": {
      "annotations": {
        "readOnlyHint": true,
        "openWorldHint": false,
        "destructiveHint": false
      },
      "justifications": {
        "read_only_justification": "Only retrieves roots, capabilities, roles, limits, and write policy for one database.",
        "open_world_justification": "Does not publish, submit, or change public internet state or third-party systems.",
        "destructive_justification": "Does not delete, overwrite, revoke access, or perform irreversible actions."
      }
    },
    "context": {
      "annotations": {
        "readOnlyHint": true,
        "openWorldHint": false,
        "destructiveHint": false
      },
      "justifications": {
        "read_only_justification": "Only retrieves task-scoped context, graph links, search hits, and source evidence from one database.",
        "open_world_justification": "Does not publish, submit, or change public internet state or third-party systems.",
        "destructive_justification": "Does not delete, overwrite, revoke access, or perform irreversible actions."
      }
    },
    "write_nodes": {
      "annotations": {
        "readOnlyHint": false,
        "openWorldHint": true,
        "destructiveHint": true
      },
      "justifications": {
        "read_only_justification": "Creates or fully replaces one to one hundred nodes atomically in a database available to the signed-in writer.",
        "open_world_justification": "Changes can become publicly visible when the selected database is public or a selected node is already published.",
        "destructive_justification": "Can fully overwrite existing node content, with etag checks available to prevent stale replacement."
      }
    },
    "mutate_nodes_batch": {
      "annotations": {
        "readOnlyHint": false,
        "openWorldHint": true,
        "destructiveHint": true
      },
      "justifications": {
        "read_only_justification": "Atomically writes, appends, edits, creates folders, moves, or deletes one to one hundred nodes in one database.",
        "open_world_justification": "Changes can become publicly visible when the selected database is public or a selected node is already published.",
        "destructive_justification": "Can overwrite, move, or delete node content, using etags and atomic rollback to guard conflicting batches."
      }
    },
    "append_nodes": {
      "annotations": {
        "readOnlyHint": false,
        "openWorldHint": true,
        "destructiveHint": true
      },
      "justifications": {
        "read_only_justification": "Appends content and optionally changes metadata or kind in one atomic batch.",
        "open_world_justification": "Changes can become publicly visible when the selected database is public or a selected node is already published.",
        "destructive_justification": "Can replace existing metadata or kind; repeated calls can duplicate appended content."
      }
    },
    "edit_nodes": {
      "annotations": {
        "readOnlyHint": false,
        "openWorldHint": true,
        "destructiveHint": true
      },
      "justifications": {
        "read_only_justification": "Replaces exact text in one atomic batch.",
        "open_world_justification": "Changes can become publicly visible when the selected database is public or a selected node is already published.",
        "destructive_justification": "Replaces existing text with etag protection."
      }
    },
    "multi_edit_nodes": {
      "annotations": {
        "readOnlyHint": false,
        "openWorldHint": true,
        "destructiveHint": true
      },
      "justifications": {
        "read_only_justification": "Applies ordered exact-text edits within nodes in one atomic batch.",
        "open_world_justification": "Changes can become publicly visible when the selected database is public or a selected node is already published.",
        "destructive_justification": "Replaces existing text with etag protection."
      }
    },
    "create_folders": {
      "annotations": {
        "readOnlyHint": false,
        "openWorldHint": true,
        "destructiveHint": false
      },
      "justifications": {
        "read_only_justification": "Creates folders in one atomic batch.",
        "open_world_justification": "Changes can become publicly visible when the selected database is public or a selected node is already published.",
        "destructive_justification": "Only creates missing folders; existing folders are unchanged and non-folder collisions fail."
      }
    },
    "move_nodes": {
      "annotations": {
        "readOnlyHint": false,
        "openWorldHint": true,
        "destructiveHint": true
      },
      "justifications": {
        "read_only_justification": "Moves or renames nodes in one atomic batch.",
        "open_world_justification": "Changes can become publicly visible when the selected database is public or a selected node is already published.",
        "destructive_justification": "Changes paths and can overwrite a destination when explicitly requested with etag protection."
      }
    },
    "delete_nodes": {
      "annotations": {
        "readOnlyHint": false,
        "openWorldHint": true,
        "destructiveHint": true
      },
      "justifications": {
        "read_only_justification": "Deletes selected nodes in one atomic batch.",
        "open_world_justification": "Changes can become publicly visible when the selected database is public or a selected node is already published.",
        "destructive_justification": "Deletes existing nodes with etag protection."
      }
    }
  },
  "test_cases": [
    {
      "description": "Discover the authenticated review database and inspect its capabilities and root inventory.",